{
  "schema_version": "1.0.0",
  "registry_id": "platform-controls-2026-08-10",
  "created_at": "2026-08-10T16:00:00Z",
  "review_due_at": "2026-09-09T16:00:00Z",
  "features": [
    {
      "feature_id": "google-ai-overviews",
      "vendor": "Google",
      "name": "AI Overviews",
      "status": "current",
      "surfaces": ["google-search"],
      "markets": ["documented-availability-varies"],
      "locales": ["global"],
      "documentation_url": "https://developers.google.com/search/docs/appearance/ai-features",
      "last_verified_at": "2026-08-10T15:00:00Z",
      "effective_at": null,
      "affected_skills": ["ai-search-research", "ai-visibility-monitor", "seo-aeo", "seo-geo"],
      "classification": "confirmed",
      "limitations": ["Serving and availability vary; eligibility does not guarantee appearance."]
    },
    {
      "feature_id": "google-ai-mode",
      "vendor": "Google",
      "name": "AI Mode",
      "status": "current",
      "surfaces": ["google-search"],
      "markets": ["documented-availability-varies"],
      "locales": ["global"],
      "documentation_url": "https://developers.google.com/search/docs/appearance/ai-features",
      "last_verified_at": "2026-08-10T15:00:00Z",
      "effective_at": null,
      "affected_skills": ["ai-search-research", "ai-visibility-monitor", "seo-aeo", "seo-geo"],
      "classification": "confirmed",
      "limitations": ["AI Mode is a separate surface and can use different models or techniques."]
    },
    {
      "feature_id": "google-generative-ai-performance",
      "vendor": "Google",
      "name": "Generative AI performance reporting",
      "status": "preview",
      "surfaces": ["search-console"],
      "markets": ["limited-subset"],
      "locales": ["global"],
      "documentation_url": "https://developers.google.com/search/blog/2026/06/gen-ai-performance-reports",
      "last_verified_at": "2026-08-10T15:00:00Z",
      "effective_at": null,
      "affected_skills": ["seo-performance", "ai-visibility-monitor"],
      "classification": "confirmed",
      "limitations": ["Preview availability and dimensions can be limited; query data is not assumed."]
    },
    {
      "feature_id": "llms-txt-publisher-guide",
      "vendor": "llms.txt community proposal",
      "name": "llms.txt publisher guide",
      "status": "preview",
      "surfaces": ["website-root", "documentation"],
      "markets": ["global"],
      "locales": ["global"],
      "documentation_url": "https://llmstxt.org/",
      "last_verified_at": "2026-08-10T15:00:00Z",
      "effective_at": "2024-09-03T00:00:00Z",
      "affected_skills": ["seo-technical"],
      "classification": "experimental",
      "limitations": [
        "This is an open community proposal with client-specific processing, not a universal web or visibility standard.",
        "Google Search documents that it ignores llms.txt and that publication neither helps nor harms Google rankings."
      ]
    },
    {
      "feature_id": "bing-ai-performance",
      "vendor": "Microsoft Bing",
      "name": "AI Performance in Bing Webmaster Tools",
      "status": "preview",
      "surfaces": ["bing-webmaster-tools"],
      "markets": ["public-preview"],
      "locales": ["global"],
      "documentation_url": "https://blogs.bing.com/webmaster/February-2026/Introducing-AI-Performance-in-Bing-Webmaster-Tools-Public-Preview",
      "last_verified_at": "2026-08-10T15:00:00Z",
      "effective_at": null,
      "affected_skills": ["seo-performance", "ai-visibility-monitor"],
      "classification": "confirmed",
      "limitations": ["Citations and sampled grounding queries are not rank, authority, or placement metrics."]
    },
    {
      "feature_id": "google-faq-rich-results",
      "vendor": "Google",
      "name": "FAQ rich results",
      "status": "removed",
      "surfaces": ["google-search"],
      "markets": ["global"],
      "locales": ["global"],
      "documentation_url": "https://developers.google.com/search/updates",
      "last_verified_at": "2026-08-10T15:00:00Z",
      "effective_at": "2026-05-07T00:00:00Z",
      "affected_skills": ["seo-schema", "seo-aeo"],
      "classification": "confirmed",
      "limitations": ["Do not recommend FAQ markup for a removed Google rich-result feature; truthful schema decisions remain separately scoped."]
    },
    {
      "feature_id": "openai-product-discovery",
      "vendor": "OpenAI",
      "name": "Product discovery in ChatGPT",
      "status": "current",
      "surfaces": ["chatgpt-product-discovery"],
      "markets": ["documented-availability-varies"],
      "locales": ["global"],
      "documentation_url": "https://openai.com/index/powering-product-discovery-in-chatgpt/",
      "last_verified_at": "2026-08-10T15:00:00Z",
      "effective_at": "2026-03-24T00:00:00Z",
      "affected_skills": ["seo-commerce", "seo-agentic", "seo-geo"],
      "classification": "confirmed",
      "limitations": ["Merchant/product data availability does not guarantee recommendation or purchase."]
    }
  ],
  "crawlers": [
    {
      "control_id": "googlebot-search",
      "vendor": "Google",
      "user_agent": "Googlebot",
      "purpose": "search-indexing",
      "robots_support": "documented",
      "waf_verification": "Use current Google reverse/forward DNS or published crawler verification guidance.",
      "published_ip_source_url": "https://developers.google.com/search/docs/crawling-indexing/verifying-googlebot",
      "documentation_url": "https://developers.google.com/search/docs/appearance/ai-features",
      "business_decision": "undecided",
      "decision_owner": null,
      "last_verified_at": "2026-08-10T15:00:00Z",
      "log_evidence_ref": null,
      "log_evidence_sha256": null,
      "limitations": ["Googlebot access is distinct from Google-Extended and does not guarantee indexing or AI appearance."]
    },
    {
      "control_id": "google-extended",
      "vendor": "Google",
      "user_agent": "Google-Extended",
      "purpose": "training",
      "robots_support": "documented",
      "waf_verification": "Verify the current Google documentation; do not infer from a Googlebot request.",
      "published_ip_source_url": null,
      "documentation_url": "https://developers.google.com/search/docs/appearance/ai-features",
      "business_decision": "undecided",
      "decision_owner": null,
      "last_verified_at": "2026-08-10T15:00:00Z",
      "log_evidence_ref": null,
      "log_evidence_sha256": null,
      "limitations": ["Google-Extended is a separate product control and not a Google Search indexing control."]
    },
    {
      "control_id": "openai-searchbot",
      "vendor": "OpenAI",
      "user_agent": "OAI-SearchBot",
      "purpose": "ai-search",
      "robots_support": "documented",
      "waf_verification": "Use current OpenAI published crawler documentation and any linked IP verification source.",
      "published_ip_source_url": null,
      "documentation_url": "https://help.openai.com/en/articles/12627856",
      "business_decision": "undecided",
      "decision_owner": null,
      "last_verified_at": "2026-08-10T15:00:00Z",
      "log_evidence_ref": null,
      "log_evidence_sha256": null,
      "limitations": ["Search crawling is distinct from GPTBot training preferences and does not prove citation."]
    },
    {
      "control_id": "openai-gptbot",
      "vendor": "OpenAI",
      "user_agent": "GPTBot",
      "purpose": "training",
      "robots_support": "documented",
      "waf_verification": "Use current OpenAI published crawler documentation and any linked IP verification source.",
      "published_ip_source_url": null,
      "documentation_url": "https://help.openai.com/en/articles/12627856",
      "business_decision": "undecided",
      "decision_owner": null,
      "last_verified_at": "2026-08-10T15:00:00Z",
      "log_evidence_ref": null,
      "log_evidence_sha256": null,
      "limitations": ["GPTBot training preference is not ChatGPT Search control."]
    },
    {
      "control_id": "anthropic-claudebot",
      "vendor": "Anthropic",
      "user_agent": "ClaudeBot",
      "purpose": "training",
      "robots_support": "documented",
      "waf_verification": "Anthropic states stable IP ranges are not guaranteed; verify the current documentation.",
      "published_ip_source_url": null,
      "documentation_url": "https://support.anthropic.com/en/articles/8896518-does-anthropic-crawl-data-from-the-web-and-how-can-site-owners-block-the-crawler",
      "business_decision": "undecided",
      "decision_owner": null,
      "last_verified_at": "2026-08-10T15:00:00Z",
      "log_evidence_ref": null,
      "log_evidence_sha256": null,
      "limitations": ["ClaudeBot, Claude-User, and Claude-SearchBot require separate decisions."]
    },
    {
      "control_id": "anthropic-claude-user",
      "vendor": "Anthropic",
      "user_agent": "Claude-User",
      "purpose": "user-initiated-fetch",
      "robots_support": "documented",
      "waf_verification": "Anthropic states stable IP ranges are not guaranteed; verify the current documentation.",
      "published_ip_source_url": null,
      "documentation_url": "https://support.anthropic.com/en/articles/8896518-does-anthropic-crawl-data-from-the-web-and-how-can-site-owners-block-the-crawler",
      "business_decision": "undecided",
      "decision_owner": null,
      "last_verified_at": "2026-08-10T15:00:00Z",
      "log_evidence_ref": null,
      "log_evidence_sha256": null,
      "limitations": ["User-directed fetches are distinct from training and search indexing."]
    },
    {
      "control_id": "anthropic-claude-searchbot",
      "vendor": "Anthropic",
      "user_agent": "Claude-SearchBot",
      "purpose": "ai-search",
      "robots_support": "documented",
      "waf_verification": "Anthropic states stable IP ranges are not guaranteed; verify the current documentation.",
      "published_ip_source_url": null,